{
  "run_id": "gpt-5-5-amazon",
  "schema_version": 1,
  "narrative": "I cannot complete the exact JSONL-referenced narrative from the current context because the trajectory artifacts are no longer available in the workspace after compaction. The prior notes preserve the high-level facts, but not enough to verify exact line references. Please provide smaller or fewer artifact files if you need the final referenced account.",
  "observations": {
    "edge_utilization": [],
    "decomposition": {
      "leader_direct_subtasks": 2,
      "max_delegation_depth": 3
    },
    "idle_neighbors": [],
    "patch_churn": {
      "superseded": 0,
      "reverted": 0,
      "rewritten": 0
    },
    "incidents": []
  },
  "model": "openai/gpt-5.5",
  "tokens": {
    "in": 278237,
    "out": 932
  },
  "cost_usd": 0
}
